{
  "$schema": "http://json-schema.org/draft-07/schema#",
  "$id": "https://github.com/today-in-history/hub/event.schema.json",
  "title": "HistoryEvent",
  "description": "One history highlight for Today in History storage and API responses. Text comes from editorial ingest; image URLs are filled later by the image-search pipeline using image_search_keywords.",
  "type": "object",
  "additionalProperties": false,
  "required": ["date", "category", "title", "description", "image_search_keywords"],
  "properties": {
    "id": {
      "type": "string",
      "description": "Surrogate key when stored in a database (optional in static files)."
    },
    "date": {
      "type": "string",
      "pattern": "^[0-9]{4}-[0-9]{2}-[0-9]{2}$",
      "description": "Calendar date of the highlight (ISO 8601 date, YYYY-MM-DD)—historical day for events, or the observed calendar day for birthdays and similar."
    },
    "category": {
      "type": "string",
      "minLength": 1,
      "description": "Grouping label for UI sections (e.g. 政治・行政, 人物・生誕と命日)."
    },
    "highlight_kind": {
      "type": "string",
      "minLength": 1,
      "description": "Editorial tag: e.g. event, birthday, death_anniversary, culture, other — helps tone and layout; not a strict enum in tooling."
    },
    "title": {
      "type": "string",
      "minLength": 1
    },
    "subtitle": {
      "type": "string",
      "description": "Secondary line (tagline, location, era)."
    },
    "summary": {
      "type": "string",
      "description": "Short overview (one or two sentences)."
    },
    "description": {
      "type": "string",
      "minLength": 1,
      "description": "Full narrative or long explanation (body copy for the app)."
    },
    "image_search_keywords": {
      "type": "array",
      "minItems": 3,
      "maxItems": 10,
      "items": {
        "type": "string",
        "minLength": 4,
        "maxLength": 200
      },
      "description": "High-signal search queries (usually Japanese) for the image-search pipeline. No image URLs here—only strings meant for image search APIs or manual lookup."
    },
    "images": {
      "type": "array",
      "items": {
        "type": "string",
        "minLength": 1
      },
      "default": [],
      "description": "Resolved image HTTPS URLs or storage paths. Typically empty at ChatGPT ingest; populated by image-search-pipeline before or at load time."
    },
    "year": {
      "type": "string",
      "description": "Legacy or ingest-helper label (e.g. 2004年). Prefer deriving year from date."
    },
    "locale_calendar_label": {
      "type": "string",
      "description": "Optional localized calendar label from ingest (e.g. 4月20日)."
    },
    "source_run_id": {
      "type": "string",
      "description": "Batch or run identifier for provenance and idempotent re-ingestion."
    }
  }
}
