[
  {
    "date": "1956-04-27",
    "category": "外交・国際",
    "highlight_kind": "event",
    "title": "日本が国際連合に加盟",
    "subtitle": "戦後復帰の象徴となった外交転機",
    "summary": "1956年4月27日、日本は国際連合への加盟が承認され、戦後の国際社会復帰を象徴する出来事となった。",
    "description": "1956年4月27日、日本の国際連合（UN）加盟が国連総会で承認された。この出来事は、第二次世界大戦後の占領期を経て主権を回復した日本が、正式に国際社会へ復帰する重要な節目として広く受け止められている。1952年のサンフランシスコ平和条約発効後、日本は国際社会への復帰を目指して外交努力を続けていたが、冷戦構造の影響により加盟は容易ではなかった。特にソ連などの拒否権が障壁となっていたが、1955年のいわゆる「国連加盟ラッシュ」の流れの中で、日本も加盟承認に至った。\n\n加盟は単なる形式的な国際機関参加にとどまらず、日本の外交政策の方向性を大きく左右した。以降、日本は国連中心主義を掲げ、平和維持活動（PKO）や国際協力の枠組みに積極的に関与するようになる。また、経済復興の進展とともに、日本は国連分担金の主要拠出国となり、国際社会における存在感を徐々に高めていった。\n\n今日においても、日本の外交は国連を軸に据える姿勢を維持しており、安全保障理事会改革や開発支援など、多様な分野で役割を果たしている。4月27日は、日本が「戦後」から「国際社会の一員」へと立ち位置を変えた日として、現代日本の外交の原点を考えるきっかけとなる。",
    "image_search_keywords": [
      "1956年 日本 国連加盟 国連総会 ニューヨーク 写真",
      "日本代表 国連加盟 承認 1956 記録写真",
      "国際連合本部 1950年代 日本加盟 関連資料",
      "UN General Assembly 1956 Japan admission photo"
    ],
    "locale_calendar_label": "4月27日",
    "year": "1956",
    "images": [
      "https://live.staticflickr.com/1652/23774446464_26a3856c45_b.jpg",
      "https://live.staticflickr.com/8330/8124627026_1914155da9_b.jpg",
      "https://live.staticflickr.com/65535/53693007042_4c195e5da0_b.jpg"
    ]
  },
  {
    "date": "1947-04-27",
    "category": "政治・行政",
    "highlight_kind": "event",
    "title": "日本国憲法施行直前の最後の準備段階",
    "subtitle": "新体制への移行が迫る",
    "summary": "1947年5月3日の日本国憲法施行を前に、4月末は制度移行の最終調整が進められていた。",
    "description": "1947年4月27日は、日本国憲法施行（5月3日）を目前に控えた重要な時期にあたる。この頃、日本政府や各行政機関では、新憲法に基づく制度への移行準備が最終段階に入っていた。帝国憲法からの大転換となる日本国憲法は、主権在民、基本的人権の尊重、平和主義を三大原則とし、国家の在り方を根本から変えるものだった。\n\nこの時期、国会制度の再編、内閣の位置づけ、地方自治制度の整備など、多岐にわたる法制度の改正が進行していた。また、女性参政権の導入や教育制度改革など、社会構造そのものも大きく変わろうとしていた。4月下旬は、こうした変革が現実の行政運用へと落とし込まれる直前の緊張感に満ちた期間だったといえる。\n\n戦後日本の民主化は、この憲法施行を起点として進んでいく。4月27日という日付は、表立った記念日ではないものの、「戦前から戦後へ」という歴史の転換点における最終準備の時間を象徴する一日として捉えることができる。",
    "image_search_keywords": [
      "1947年 日本国憲法 施行準備 国会 議事堂 写真",
      "戦後 日本 政治改革 1947 行政資料 写真",
      "GHQ 憲法改正期 日本 政府会議 画像",
      "Japanese Constitution 1947 preparation Diet building photo"
    ],
    "locale_calendar_label": "4月27日",
    "year": "1947",
    "images": [
      "https://live.staticflickr.com/186/441531453_201d10e5eb.jpg",
      "https://live.staticflickr.com/182/441531514_6c821c391d.jpg",
      "https://live.staticflickr.com/207/441531324_312c2d359f.jpg"
    ]
  },
  {
    "date": "1978-04-27",
    "category": "経済・産業",
    "highlight_kind": "event",
    "title": "成田空港開港直前の緊張高まる",
    "subtitle": "国際ハブ誕生の裏側",
    "summary": "1978年の成田空港開港を目前に控え、反対運動と警備体制が大きな社会問題となっていた。",
    "description": "1978年4月27日は、新東京国際空港（現在の成田国際空港）の開港を約1か月後に控えた時期であり、日本の航空インフラ整備と社会対立が交錯する象徴的な局面だった。高度経済成長期、日本は国際交通の拡大に対応するため新たな国際空港の建設を進めていたが、千葉県成田市周辺では用地取得や農地問題を巡る激しい反対運動が続いていた。\n\nこの頃、空港建設はほぼ完成していたものの、反対派との衝突や警備強化が社会的関心を集めていた。特に滑走路周辺では衝突事件が頻発し、日本国内における公共事業と住民権利のバランスが問われる事態となった。政府は警察力を動員して開港準備を進める一方、地域社会との溝は深いままだった。\n\nその後、成田空港は日本の主要な国際玄関口として機能し続けるが、その成立過程は単なるインフラ整備ではなく、戦後日本社会の矛盾や葛藤を映し出す出来事でもあった。4月下旬のこの時期は、まさにその緊張が最高潮に達していた瞬間といえる。",
    "image_search_keywords": [
      "1978年 成田空港 開港前 警備隊 写真",
      "新東京国際空港 建設反対運動 1978 画像",
      "成田空港 滑走路 建設 現場 昭和 写真",
      "Narita Airport construction protest 1978 photo"
    ],
    "locale_calendar_label": "4月27日",
    "year": "1978",
    "images": [
      "https://upload.wikimedia.org/wikipedia/commons/d/d4/Sadayuki_Mikami_%281979%29.jpg",
      "https://live.staticflickr.com/2184/2389381725_e46b747b10_b.jpg",
      "https://live.staticflickr.com/2222/2390209616_f38845dbe0_b.jpg"
    ]
  },
  {
    "date": "1981-04-27",
    "category": "社会・文化",
    "highlight_kind": "culture",
    "title": "テレビと家庭文化の変化が進む時代",
    "subtitle": "1980年代の生活様式の転換期",
    "summary": "1980年代初頭、日本ではテレビを中心とした家庭文化が大きく変化していた。",
    "description": "1981年4月27日前後は、日本の家庭文化においてテレビが中心的役割を果たしていた時代の象徴的な時期である。高度経済成長を経て家電が広く普及し、カラーテレビはすでに一家に一台の存在となっていた。家族が同じ番組を囲むスタイルが一般的であり、ニュース、ドラマ、バラエティなどが日常生活のリズムを形成していた。\n\nこの時期は、民放各局が視聴率競争を激化させ、番組制作の質や多様性が急速に高まった時代でもある。クイズ番組や音楽番組、トレンディドラマの萌芽が見られ、若者文化や消費文化と密接に結びついていった。また、CMを通じた広告産業の成長も著しく、テレビは単なる娯楽装置を超えて、社会全体の価値観形成に影響を与えるメディアへと進化していた。\n\n4月という新生活の始まりの季節は、番組改編期とも重なり、新しい番組やスターが登場するタイミングでもある。この頃のテレビ文化は、現代の多様化したメディア環境の原点ともいえる存在であり、1980年代初頭はその成熟の入り口にあった。",
    "image_search_keywords": [
      "1981年 日本 テレビ 家庭 リビング 昭和 写真",
      "昭和 テレビ番組 視聴風景 家族 写真 1980年代",
      "日本 家電 普及 カラーテレビ 1980年代 写真",
      "Japan 1980s TV living room family photo"
    ],
    "locale_calendar_label": "4月27日",
    "year": "1981",
    "images": [
      "https://live.staticflickr.com/8339/8205643197_4386497ccc_b.jpg",
      "https://live.staticflickr.com/7345/12837801584_b748fe7016_b.jpg",
      "https://live.staticflickr.com/3710/12837452043_6aa89f858d_b.jpg"
    ]
  },
  {
    "date": "1791-04-27",
    "category": "人物・生誕と命日",
    "highlight_kind": "birthday",
    "title": "サミュエル・モールス誕生",
    "subtitle": "通信の歴史を変えた発明者",
    "summary": "モールス信号を開発したサミュエル・モールスが1791年4月27日に誕生した。",
    "description": "1791年4月27日は、電信技術の基礎を築いた発明家サミュエル・モールスの誕生日である。彼はモールス信号の開発者として知られ、19世紀の通信革命を牽引した人物だ。モールス信号は、点と線の組み合わせで文字を表現するシンプルかつ効率的な仕組みであり、電信技術と結びつくことで長距離通信を劇的に変化させた。\n\nこの技術は日本にも明治時代に導入され、近代化の重要な要素となった。鉄道網の発展や行政通信、報道の迅速化など、モールス信号は日本社会のインフラ整備に深く関わっている。また、無線通信や現代のデジタル通信に至るまで、その基本思想は継承されている。\n\n今日ではモールス信号を日常的に使う場面は少なくなったが、災害時の非常通信やアマチュア無線などで今なお活用されている。4月27日は、情報が瞬時に伝わる現代社会の原点を思い起こさせる日でもある。",
    "image_search_keywords": [
      "サミュエル モールス 肖像 19世紀 写真",
      "モールス信号 電信機 古典装置 写真",
      "電信 通信機器 明治 日本 モールス信号 資料",
      "Samuel Morse portrait telegraph device photo"
    ],
    "locale_calendar_label": "4月27日",
    "year": "1791",
    "images": [
      "https://live.staticflickr.com/8100/8505891762_9a11b4da96.jpg"
    ]
  }
]
